{
  "schema_version": "1.0.0", "record_type": "attempt_outcome_event", "event_id": "case-F-original", "attempt_id": "case-F-attempt",
  "record_kind": "terminal_outcome", "recorded_at": "2026-08-02T12:51:00Z", "author": "synthetic-agent", "confidence": "low",
  "evidence_refs": ["evidence://case-F/input-log"], "supersedes_event_id": null, "execution_status": "failed",
  "gate_results": [
    {"gate_id": "case-F-input", "sequence": 1, "kind": "preparatory", "execution_status": "failed", "executed": true, "result": "failed", "proof_status": "FAIL", "evidence_refs": ["evidence://case-F/input-log"]},
    {"gate_id": "case-F-product", "sequence": 2, "kind": "product", "execution_status": "prepared", "executed": false, "result": "not_executed", "proof_status": "UNAVAILABLE", "evidence_refs": []}
  ],
  "last_successful_gate": null, "terminal_gate": "case-F-input", "product_gate_executed": false, "product_verdict": "not_executed",
  "primary_failure_classification": "unclassified", "contributing_factors": [], "relations": []
}
