{
  "schema_version": "1.0.0", "record_type": "attempt_outcome_event", "event_id": "case-H-outcome", "attempt_id": "case-H-attempt",
  "record_kind": "terminal_outcome", "recorded_at": "2026-08-02T13:31:00Z", "author": "synthetic-runner", "confidence": "high",
  "evidence_refs": ["evidence://case-H/environment-log"], "supersedes_event_id": null, "execution_status": "failed",
  "gate_results": [
    {"gate_id": "case-H-environment", "sequence": 1, "kind": "preparatory", "execution_status": "failed", "executed": true, "result": "failed", "proof_status": "FAIL", "evidence_refs": ["evidence://case-H/environment-log"]},
    {"gate_id": "case-H-product", "sequence": 2, "kind": "product", "execution_status": "prepared", "executed": false, "result": "not_executed", "proof_status": "UNAVAILABLE", "evidence_refs": []}
  ],
  "last_successful_gate": null, "terminal_gate": "case-H-environment", "product_gate_executed": false, "product_verdict": "not_executed",
  "primary_failure_classification": "environment_failure", "contributing_factors": [], "relations": []
}
